{
  "card_id": "card_001",
  "thread_id": "thread_line_group_001",
  "source": "line_notification",
  "sender": "實驗室群組",
  "summary": "明天下午三點開會，群組正在等你確認是否參加。",
  "priority": "high",
  "requires_reply": "yes",
  "deadline_text": "明天下午三點",
  "actions": [
    "open_source",
    "create_reminder",
    "snooze"
  ],
  "display_mode": "surface_now",
  "why_shown": [
    "direct_question",
    "explicit_meeting_time"
  ],
  "created_at": "2026-08-02T18:35:07+08:00"
}
